{
  "schema_version": "catalog_item.v1",
  "seller_id": "dh-store-990367",
  "item_id_local": "dh-p-990000001",
  "source": "dunnhumby",
  "description_text": "990 G",
  "title_text": "TEST TYPE WHOLE",
  "category_path": ["TEST DEPT", "TEST CAT DAIRY"],
  "listing_status": "active",
  "first_listed_at": null
}
