[
  {
    "schema_version": "catalog_item.v1",
    "seller_id": "seller-a",
    "item_id_local": "item-1",
    "source": "live",
    "title_text": "유기농 우유 1L",
    "description_text": "무항생제 인증 목장의 원유만 사용",
    "category_path": [
      "식품",
      "유제품",
      "우유"
    ],
    "listing_status": "active",
    "first_listed_at": "2026-09-01T00:00:00Z"
  },
  {
    "schema_version": "catalog_item.v1",
    "seller_id": "seller-a",
    "item_id_local": "item-2",
    "source": "live",
    "title_text": "일반 우유 1L",
    "description_text": null,
    "category_path": [
      "식품",
      "유제품",
      "우유"
    ],
    "listing_status": "active",
    "first_listed_at": "2026-09-01T00:00:00Z"
  },
  {
    "schema_version": "catalog_item.v1",
    "seller_id": "seller-a",
    "item_id_local": "item-3",
    "source": "live",
    "title_text": "무가당 두유 950ml",
    "description_text": null,
    "category_path": [
      "식품",
      "음료",
      "두유"
    ],
    "listing_status": "active",
    "first_listed_at": "2026-09-01T00:00:00Z"
  },
  {
    "schema_version": "catalog_item.v1",
    "seller_id": "seller-a",
    "item_id_local": "item-4",
    "source": "live",
    "title_text": "가당 두유 950ml",
    "description_text": null,
    "category_path": [
      "식품",
      "음료",
      "두유"
    ],
    "listing_status": "active",
    "first_listed_at": "2026-09-01T00:00:00Z"
  },
  {
    "schema_version": "catalog_item.v1",
    "seller_id": "seller-a",
    "item_id_local": "item-5",
    "source": "live",
    "title_text": "통밀 식빵 450g",
    "description_text": "국산 통밀 100%",
    "category_path": [
      "식품",
      "베이커리",
      "식빵"
    ],
    "listing_status": "active",
    "first_listed_at": "2026-09-02T00:00:00Z"
  },
  {
    "schema_version": "catalog_item.v1",
    "seller_id": "seller-a",
    "item_id_local": "item-6",
    "source": "live",
    "title_text": "통밀 식빵 900g",
    "description_text": "국산 통밀 100%",
    "category_path": [
      "식품",
      "베이커리",
      "식빵"
    ],
    "listing_status": "active",
    "first_listed_at": "2026-09-02T00:00:00Z"
  },
  {
    "schema_version": "catalog_item.v1",
    "seller_id": "seller-a",
    "item_id_local": "item-7",
    "source": "live",
    "title_text": "그릭 요거트 Greek Yogurt 0.5kg",
    "description_text": "",
    "category_path": null,
    "listing_status": "active",
    "first_listed_at": "2026-09-03T00:00:00Z"
  },
  {
    "schema_version": "catalog_item.v1",
    "seller_id": "seller-a",
    "item_id_local": "item-8",
    "source": "live",
    "title_text": "제주  감귤 주스 1/2 L",
    "description_text": null,
    "category_path": [
      "식품",
      "음료"
    ],
    "listing_status": "inactive",
    "first_listed_at": "2026-09-20T00:00:00Z"
  }
]
