{
  "schema_version": "catalog_item.v1",
  "seller_id": "seller-a",
  "item_id_local": "item-42",
  "source": "live",
  "title_text": "유기농 통밀 식빵 450g",
  "description_text": "국산 통밀 100%로 구운 식빵이다.",
  "category_path": [
    "식품",
    "베이커리",
    "식빵"
  ],
  "listing_status": "active",
  "first_listed_at": "2026-09-22T02:00:00Z"
}
