{
  "schema_version": "catalog_item.v1",
  "seller_id": "ic-client-990007",
  "item_id_local": "ic-p-990001",
  "source": "instacart",
  "title_text": "Soda",
  "description_text": "aisle: soft drinks | department: beverages",
  "category_path": [
    "beverages",
    "soft drinks"
  ],
  "listing_status": "inactive",
  "first_listed_at": null
}
